{
  "$schema": "../../catalog/schemas/script.schema.json",
  "ad": "explainer",
  "title": "Curate, explained: the voiceover",
  "source": "Round-2 explainer script (marketing/videos tracker, entry \"explainer\"; copy in tracker/legacy/status.js). Opening timings from the ExOpen motion test (ads/_legacy/remotion-src/mt/ExOpen.tsx); the rest from the storyboard's time codes.",
  "language": "en-US",
  "cuts": { "30": ["problem", "meet-zee", "photos"] },
  "scenes": [
    { "key": "problem", "title": "The problem", "startHint": 0, "endHint": 8.5, "picture": "A wall of Emma's pieces that keeps shuffling and never lands; a clock at 8:02; 'Nothing to wear.' The pile blows out on the music's swell." },
    { "key": "meet-zee", "title": "Meet Zee", "startHint": 8.5, "endHint": 15.5, "picture": "Zee's hello lands on the swell, then a few moods; 'Meet Zee.'" },
    { "key": "photos", "title": "Your wardrobe, from your photos", "startHint": 15.5, "endHint": 27, "picture": "Her camera roll on the phone; her photo pops out big; the white tee lifts out of it; 'Already in your photos.'" },
    { "key": "scan", "title": "Privacy, the selfie and the scan", "startHint": 27, "endHint": 58, "picture": "0:30 the privacy shield with Zee peeking; 0:36 the selfie ring draws on; 0:44 scan dots and a white outline trace a piece; 0:50 one photo up big, a piece pops out, Zee names it." },
    { "key": "pure-float", "title": "Pure-float pieces", "startHint": 58, "endHint": 70, "picture": "The Wardrobe tab, pieces floating and bobbing; one opens up big." },
    { "key": "chat", "title": "Chat with Zee", "startHint": 70, "endHint": 110, "picture": "The question typed; Zee's thinking lines; a question card; the look lands as a flash then a tilted print; Adjust; the Style notes." },
    { "key": "weather", "title": "Weather and location", "startHint": 110, "endHint": 125, "picture": "The foggy-window location ask, Apple's popup, the look card's weather line ('58°F · Rain at 4')." },
    { "key": "try-ons", "title": "Try-ons", "startHint": 125, "endHint": 145, "picture": "The Try-ons tab, her photo plus two pieces, the curtain, the result; she rises out of her selfie in look 1, then look 2." },
    { "key": "ready", "title": "Tell me when it's ready", "startHint": 145, "endHint": 155, "picture": "The pieces wait with the pill, the notification permission, the push on the lock screen." },
    { "key": "outro", "title": "Outro", "startHint": 155, "endHint": 170, "picture": "A stroke draws round the frame; the Curate logo, 'Your closet, styled by Zee.', the App Store badge; Zee waves." }
  ],
  "lines": [
    { "id": "l01", "scene": "problem", "startHint": 0.5, "endHint": 3.6, "text": "You've got a closet full of clothes.", "keyPhrases": ["closet full of clothes"] },
    { "id": "l02", "scene": "problem", "startHint": 3.7, "endHint": 7.6, "text": "And somehow, every morning, it's the same thing: nothing to wear.", "keyPhrases": ["nothing to wear"] },
    { "id": "l03", "scene": "meet-zee", "startHint": 8.6, "endHint": 11.4, "text": "Meet Zee. She's your stylist.", "keyPhrases": ["Meet Zee", "your stylist"] },
    { "id": "l04", "scene": "meet-zee", "startHint": 11.5, "endHint": 15.4, "text": "She lives in Curate, she learns your closet, and she's always up early.", "keyPhrases": ["learns your closet"] },
    { "id": "l05", "scene": "photos", "startHint": 15.6, "endHint": 18.4, "text": "First, Zee needs to see what you own.", "keyPhrases": ["what you own"] },
    { "id": "l06", "scene": "photos", "startHint": 18.5, "endHint": 20.4, "text": "No photo shoots, no typing.", "keyPhrases": ["No photo shoots, no typing"] },
    { "id": "l07", "scene": "photos", "startHint": 20.5, "endHint": 24.6, "text": "Your clothes are already in your photos, because you wear them.", "keyPhrases": ["already in your photos"] },
    { "id": "l08", "scene": "scan", "startHint": 29.5, "endHint": 32, "text": "Zee asks before she looks.", "keyPhrases": ["asks before she looks"] },
    { "id": "l09", "scene": "scan", "startHint": 36, "endHint": 40, "text": "You take one selfie, so she knows which one is you.", "keyPhrases": ["one selfie"] },
    { "id": "l10", "scene": "scan", "startHint": 44, "endHint": 49.5, "text": "Then she finds you in your photos, and your pieces start arriving, one by one.", "keyPhrases": ["your pieces start arriving"] },
    { "id": "l11", "scene": "pure-float", "startHint": 58.5, "endHint": 65, "text": "Every piece comes out clean, floating on its own, like a product photo of your actual clothes.", "keyPhrases": ["your actual clothes"] },
    { "id": "l12", "scene": "chat", "startHint": 70.5, "endHint": 72.3, "text": "Now ask Zee anything.", "keyPhrases": ["ask Zee anything"] },
    { "id": "l13", "scene": "chat", "startHint": 72.5, "endHint": 75.5, "text": "“What do I wear to dinner on Friday?”", "keyPhrases": ["dinner on Friday"] },
    { "id": "l14", "scene": "chat", "startHint": 76, "endHint": 82.5, "text": "You can watch her think: she checks the weather, looks through your closet, and makes her calls.", "keyPhrases": ["watch her think"] },
    { "id": "l15", "scene": "chat", "startHint": 86, "endHint": 89.5, "text": "If she needs something only you know, she just asks.", "keyPhrases": ["she just asks"] },
    { "id": "l16", "scene": "chat", "startHint": 93, "endHint": 95, "text": "Then your look lands.", "keyPhrases": ["your look lands"] },
    { "id": "l17", "scene": "chat", "startHint": 100, "endHint": 103, "text": "Want it more relaxed? Tap Adjust.", "keyPhrases": ["Tap Adjust"] },
    { "id": "l18", "scene": "chat", "startHint": 105, "endHint": 108.5, "text": "Curious why it works? Open the Style notes.", "keyPhrases": ["Style notes"] },
    { "id": "l19", "scene": "weather", "startHint": 110.5, "endHint": 114, "text": "Zee dresses you for the weather where you are.", "keyPhrases": ["the weather where you are"] },
    { "id": "l20", "scene": "weather", "startHint": 115, "endHint": 120.5, "text": "She'll ask once to use your location, or you can just tell her your city.", "keyPhrases": ["tell her your city"] },
    { "id": "l21", "scene": "try-ons", "startHint": 125.5, "endHint": 128.5, "text": "Not sure? See it on you first.", "keyPhrases": ["See it on you"] },
    { "id": "l22", "scene": "try-ons", "startHint": 129, "endHint": 135, "text": "Pick a photo of you, pick your pieces, and Try-ons shows you wearing the look.", "spoken": "Pick a photo of you, pick your pieces, and Try ons shows you wearing the look.", "keyPhrases": ["you wearing the look"] },
    { "id": "l23", "scene": "ready", "startHint": 145.5, "endHint": 147.8, "text": "Good things take a minute.", "keyPhrases": [] },
    { "id": "l24", "scene": "ready", "startHint": 148, "endHint": 154, "text": "Tap “Tell me when it's ready”, put your phone down, and Zee will let you know.", "keyPhrases": ["Tell me when it's ready"] },
    { "id": "l25", "scene": "outro", "startHint": 156, "endHint": 160, "text": "Curate. Your closet, styled by Zee.", "keyPhrases": ["Your closet, styled by Zee."] },
    { "id": "l26", "scene": "outro", "startHint": 160.5, "endHint": 163.5, "text": "Get it on the App Store.", "keyPhrases": ["App Store"] }
  ]
}
